{"atomic_commit_status":"not_committed_fallback_preserved","attempt_status":"attempted_network_unavailable_fallback_active","attempted_at_utc":"2026-07-10T00:00:00Z","candidate_binding_status":"version_bound","candidate_release":"v40.04r03","canonical_lock_path":"governance/UPSTREAM_RELEASE_LOCK.json","canonical_lock_present":false,"dependency_order":["AF","AFC","GM","AOD"],"failure_class":"URLError","failure_message":"GitHub latest-release refresh unavailable: URLError: <urlopen error [Errno -3] Temporary failure in name resolution>","fallback_snapshot_path":"governance/UPSTREAM_FALLBACK_SNAPSHOT.json","fallback_snapshot_sha256":"07308a3f2cc0c8181de17bf33fe41c127241ffb760ac0655334e32071777d6fe","partial_mutation_rollback_status":"passed_no_candidate_mutation","receipt_id":"refresh_attempt_v40.04r03_001","record_scope":"candidate_refresh_attempt","refresh_mode":"always_attempt_latest_on_authoring","resolved_lock_sha256":null,"resolver_version":"3.1","schema_version":"3.1","staging_mode":"isolated_full_tree_atomic_commit"}
